{
  "schema_version": "0.1",
  "source_id": "P006_Saetang_2024_NiMo_MgO_Biogas_CNT",
  "source_title": "Simultaneous production of syngas and carbon nanotubes from CO2/CH4 mixture over high-performance NiMo/MgO catalyst",
  "input_content_hash": "2ded82b09377b14fc6a464fd35b4eaa666d98ca2610ac9a0fbd7229e6e2742f2",
  "extraction_scope": "candidate_spans_only",
  "run_candidates": [
    {
      "candidate_run_id": "RUN_CAND_001",
      "relevance_class": "high",
      "confidence": 0.9,
      "run_split_basis": "temperature and feed gas ratio",
      "evidence_span_ids": [
        "SPAN_496B05C26E18A4B7F254",
        "SPAN_8B9C63203887739836BB",
        "SPAN_23F0A079905EF03F88BF",
        "SPAN_928458CBC3DD841598BE",
        "SPAN_B6D190030E5EFCE87791",
        "SPAN_221E5BB2960BF761009A"
      ],
      "run_summary": "CNT growth using NiMo/MgO catalyst at 800°C with CH4/CO2 feed gas, yielding 2.60 gProduct/gCat-h CNT yield",
      "run_label": "NiMo/MgO catalyst CNT growth at 800°C"
    }
  ],
  "catalyst_candidates": [
    {
      "preparation_detail": "dissolved in distilled water, mixed with MgO nanopowder, evaporated at 80°C, calcined at 500°C for 3h at 10°C/min ramp",
      "calcination_condition": "500°C for 3h at 10°C/min ramp",
      "BET_surface_area_m2_g": null,
      "metal_ratio_original": "1:1",
      "candidate_run_id": "RUN_CAND_001",
      "promoter": null,
      "catalyst_particle_size_range_nm": null,
      "preparation_modifier": null,
      "support_material": "MgO",
      "active_metals": [
        "Ni",
        "Mo"
      ],
      "candidate_catalyst_id": "CAT_CAND_001",
      "precursor_summary": "Ni(NO3)2·6H2O and (NH4)6Mo7O24·4H2O",
      "evidence_span_ids": [
        "SPAN_D3B9559979B6ACEE3F93"
      ],
      "activation_condition": null,
      "preparation_method": "wetness impregnation",
      "phase_or_state_summary": null,
      "reduction_condition": null,
      "drying_condition": "evaporated at 80°C",
      "confidence": 0.9,
      "catalyst_label": "NiMo/MgO"
    }
  ],
  "process_stage_candidates": [
    {
      "carbon_source_flow_original": null,
      "process_note": "highest CNT yield at 800°C with 2.60 gProduct/gCat-h",
      "temperature_setpoint_C": 800,
      "scale_level": "laboratory",
      "inert_gas_flow_original": null,
      "cofeed_or_reactive_gas": null,
      "candidate_stage_id": "STAGE_CAND_001",
      "holding_time_min": 180,
      "reducing_gas_flow_original": null,
      "carbon_source": "CH4/CO2",
      "catalyst_loading_mass_g": null,
      "reactor_type": "fixed bed",
      "reducing_gas": null,
      "cofeed_flow_original": null,
      "carbon_source_flow_sccm": null,
      "total_flow_sccm": null,
      "confidence": 0.9,
      "inert_gas": null,
      "total_flow_original": null,
      "temperature_range_reported_C": null,
      "candidate_run_id": "RUN_CAND_001",
      "gas_composition_summary": "CH4/CO2 ratio 1.5/1, 1/1, 0.5/1",
      "reactor_size_summary": null,
      "reducing_gas_flow_sccm": null,
      "stage_order": 1,
      "pressure_kPa": null,
      "pressure_original": null,
      "stage_type": "cnt_growth",
      "inert_gas_flow_sccm": null,
      "GHSV_or_residence_time": null,
      "evidence_span_ids": [
        "SPAN_496B05C26E18A4B7F254",
        "SPAN_8B9C63203887739836BB",
        "SPAN_928458CBC3DD841598BE",
        "SPAN_B6D190030E5EFCE87791"
      ],
      "reactor_material": null,
      "cofeed_flow_sccm": null
    }
  ],
  "product_candidates": [
    {
      "primary_yield_metric": "CNT_productivity",
      "Raman_ratio_value": 0.87,
      "candidate_run_id": "RUN_CAND_001",
      "yield_calculation_method": "direct measurement",
      "yield_value_standardized": 2.6,
      "CNT_productivity_g_gcat_h": 2.6,
      "purified_product_purity_wt_percent": 84.0,
      "product_mixture_summary": "CNTs with some amorphous carbon",
      "CNT_type_confirmed": null,
      "post_treatment_or_purification": "none",
      "amorphous_carbon_level": null,
      "carbon_source_conversion_percent": null,
      "yield_unit_standardized": "g/gcat/h",
      "CNT_type_reported": "MWCNTs",
      "yield_definition_original": "CNT yield",
      "candidate_product_id": "PROD_CAND_001",
      "purity_basis": "author_unspecified",
      "wall_number_summary": "multi-walled",
      "yield_original": "2.60 gProduct/gCat-h",
      "evidence_span_ids": [
        "SPAN_496B05C26E18A4B7F254",
        "SPAN_8B9C63203887739836BB",
        "SPAN_23F0A079905EF03F88BF",
        "SPAN_928458CBC3DD841598BE",
        "SPAN_B6D190030E5EFCE87791",
        "SPAN_221E5BB2960BF761009A"
      ],
      "morphology": "dense, smooth surface",
      "CNT_yield_per_catalyst_g_gcat": 2.6,
      "Raman_ratio_type": "IG/ID",
      "carbon_conversion_to_solid_percent": null,
      "TGA_carbon_content_wt_percent": 87.2,
      "characterization_methods": [
        "SEM",
        "TEM",
        "Raman",
        "TGA"
      ],
      "confidence": 0.9,
      "CNT_type_evidence": "SEM/TEM analysis",
      "outer_diameter_range_nm": "23-24 nm"
    }
  ],
  "cost_scale_candidates": [
    {
      "safety_risk": null,
      "candidate_run_id": "RUN_CAND_001",
      "quantitative_cost_reported": false,
      "cost_driver_summary": null,
      "emission_or_waste": null,
      "batch_stability": null,
      "scale_up_issue": null,
      "quantitative_cost_summary": null,
      "evidence_span_ids": [
        "SPAN_496B05C26E18A4B7F254"
      ],
      "candidate_cost_scale_id": "SCALE_CAND_001",
      "scale_level_demonstrated": "laboratory",
      "scale_evidence_summary": "single reactor experiment",
      "catalyst_lifetime_or_reuse": null,
      "reactor_capacity_or_throughput": null,
      "confidence": 0.9,
      "continuous_operation_time_h": 3,
      "scale_level_claimed": null
    }
  ],
  "source_observations": [
    {
      "confidence": 0.9,
      "evidence_span_ids": [
        "SPAN_496B05C26E18A4B7F254"
      ],
      "summary": "CNT yield of 2.60 gProduct/gCat-h at 800°C",
      "observation_type": "other",
      "value_status": "reported",
      "candidate_observation_id": "OBS_CAND_001"
    },
    {
      "confidence": 0.9,
      "evidence_span_ids": [
        "SPAN_221E5BB2960BF761009A"
      ],
      "summary": "MWCNTs with diameter 23-24 nm, smooth surface",
      "observation_type": "other",
      "value_status": "reported",
      "candidate_observation_id": "OBS_CAND_002"
    },
    {
      "confidence": 0.9,
      "evidence_span_ids": [
        "SPAN_B6D190030E5EFCE87791"
      ],
      "summary": "CNT purity 84.0% by TGA",
      "observation_type": "other",
      "value_status": "reported",
      "candidate_observation_id": "OBS_CAND_003"
    }
  ],
  "evidence_claims": [
    {
      "claim_id": "CLM_001",
      "target_type": "run",
      "target_id": "RUN_CAND_001",
      "target_fields": [
        "run_label",
        "run_summary",
        "run_split_basis"
      ],
      "span_ids": [
        "SPAN_496B05C26E18A4B7F254",
        "SPAN_8B9C63203887739836BB",
        "SPAN_928458CBC3DD841598BE",
        "SPAN_B6D190030E5EFCE87791"
      ],
      "evidence_quote": "The highest CNT yield of 2.60 gProduct/gCat-h was achieved at 800 °C.",
      "value_status": "reported",
      "confidence": 0.9,
      "notes": "Multiple spans confirm 800°C as optimal temperature with highest yield"
    }
  ],
  "review_issues": [
    {
      "candidate_issue_id": "ISSUE_CAND_001",
      "candidate_run_id": "RUN_CAND_001",
      "issue_type": "definition_ambiguity",
      "target_type": "product",
      "target_id": "PROD_CAND_001",
      "target_field": "CNT_type_reported",
      "issue_summary": "Reported as MWCNTs but no explicit confirmation of multi-walled structure in text",
      "conflicting_values": [],
      "evidence_span_ids": [
        "SPAN_221E5BB2960BF761009A"
      ],
      "severity": "medium",
      "review_status": "open"
    }
  ],
  "extraction_notes": "Multiple spans confirm 800°C as optimal temperature with highest yield. CNT type reported as MWCNTs but no explicit confirmation in text. Some fields like BET surface area and catalyst particle size not reported in input."
}
